ID,Dataset_ID,Language_ID,Name,Note,Other,Source,Category,Structure,Rating,Tag,Datatype,valueUrl
Vejdemo-2016-167-RANK,Vejdemo-2016-167,eng,,This value indicates the stability rank of a word and its resistance to borrowing across languages.,rank,,relations,ordinality,corpus,stability,"{""datatype"": {""base"": ""positiveInteger"", ""minimum"": ""1"", ""maximum"": ""167""}, ""name"": ""RANK""}",
Vejdemo-2016-167-RATE,Vejdemo-2016-167,eng,,"The rate of lexical replacement for the specified concepts in English, Danish, Dutch, German and Swedish, according to word class, frequency, age of acquisition, synonyms, arousal, imageability and average mutual information either from published databases or from corpora and lexica.",score,,relations,numeric,corpus,stability,"{""datatype"": ""float"", ""name"": ""RATE""}",
Vulic-2020-2244-ENGLISH_SIMILARITY,Vulic-2020-2244,eng,,The similarity to other words in the language rated on a scale from 0-6.,,,relations,mean,users,similarity,"{""datatype"": {""base"": ""json"", ""format"": ""{\""type\"":\""object\"",\""patternProperties\"":{\"".+\"": {\""type\"": \""object\"", \""required\"":[\""Score\"",\""Concepticon_ID\""],\""properties\"":{\""Score\"":{\""type\"":\""number\""},\""Concepticon_ID\"":\""oneOf\"":[{\""type\"":\""number\""},{\""type\"":\""null\""}]}}}}""}, ""name"": ""ENGLISH_SIMILARITY""}",
Vulic-2020-2244-ARABIC_SIMILARITY,Vulic-2020-2244,ara,,The similarity to other words in the language rated on a scale from 0-6.,,,relations,mean,users,similarity,"{""datatype"": {""base"": ""json"", ""format"": ""{\""type\"":\""object\"",\""patternProperties\"":{\"".+\"": {\""type\"": \""object\"", \""required\"":[\""Score\"",\""Concepticon_ID\""],\""properties\"":{\""Score\"":{\""type\"":\""number\""},\""Concepticon_ID\"":\""oneOf\"":[{\""type\"":\""number\""},{\""type\"":\""null\""}]}}}}""}, ""name"": ""ARABIC_SIMILARITY""}",
Vulic-2020-2244-CHINESE_SIMILARITY,Vulic-2020-2244,zho,,The similarity to other words in the language rated on a scale from 0-6.,,,relations,mean,users,similarity,"{""datatype"": {""base"": ""json"", ""format"": ""{\""type\"":\""object\"",\""patternProperties\"":{\"".+\"": {\""type\"": \""object\"", \""required\"":[\""Score\"",\""Concepticon_ID\""],\""properties\"":{\""Score\"":{\""type\"":\""number\""},\""Concepticon_ID\"":\""oneOf\"":[{\""type\"":\""number\""},{\""type\"":\""null\""}]}}}}""}, ""name"": ""CHINESE_SIMILARITY""}",
Vulic-2020-2244-WELSH_SIMILARITY,Vulic-2020-2244,cym,,The similarity to other words in the language rated on a scale from 0-6.,,,relations,mean,users,similarity,"{""datatype"": {""base"": ""json"", ""format"": ""{\""type\"":\""object\"",\""patternProperties\"":{\"".+\"": {\""type\"": \""object\"", \""required\"":[\""Score\"",\""Concepticon_ID\""],\""properties\"":{\""Score\"":{\""type\"":\""number\""},\""Concepticon_ID\"":\""oneOf\"":[{\""type\"":\""number\""},{\""type\"":\""null\""}]}}}}""}, ""name"": ""WELSH_SIMILARITY""}",
Vulic-2020-2244-ESTONIAN_SIMILARITY,Vulic-2020-2244,est,,The similarity to other words in the language rated on a scale from 0-6.,,,relations,mean,users,similarity,"{""datatype"": {""base"": ""json"", ""format"": ""{\""type\"":\""object\"",\""patternProperties\"":{\"".+\"": {\""type\"": \""object\"", \""required\"":[\""Score\"",\""Concepticon_ID\""],\""properties\"":{\""Score\"":{\""type\"":\""number\""},\""Concepticon_ID\"":\""oneOf\"":[{\""type\"":\""number\""},{\""type\"":\""null\""}]}}}}""}, ""name"": ""ESTONIAN_SIMILARITY""}",
Vulic-2020-2244-FINNISH_SIMILARITY,Vulic-2020-2244,fin,,The similarity to other words in the language rated on a scale from 0-6.,,,relations,mean,users,similarity,"{""datatype"": {""base"": ""json"", ""format"": ""{\""type\"":\""object\"",\""patternProperties\"":{\"".+\"": {\""type\"": \""object\"", \""required\"":[\""Score\"",\""Concepticon_ID\""],\""properties\"":{\""Score\"":{\""type\"":\""number\""},\""Concepticon_ID\"":\""oneOf\"":[{\""type\"":\""number\""},{\""type\"":\""null\""}]}}}}""}, ""name"": ""FINNISH_SIMILARITY""}",
Vulic-2020-2244-FRENCH_SIMILARITY,Vulic-2020-2244,fra,,The similarity to other words in the language rated on a scale from 0-6.,,,relations,mean,users,similarity,"{""datatype"": {""base"": ""json"", ""format"": ""{\""type\"":\""object\"",\""patternProperties\"":{\"".+\"": {\""type\"": \""object\"", \""required\"":[\""Score\"",\""Concepticon_ID\""],\""properties\"":{\""Score\"":{\""type\"":\""number\""},\""Concepticon_ID\"":\""oneOf\"":[{\""type\"":\""number\""},{\""type\"":\""null\""}]}}}}""}, ""name"": ""FRENCH_SIMILARITY""}",
Vulic-2020-2244-HEBREW_SIMILARITY,Vulic-2020-2244,heb,,The similarity to other words in the language rated on a scale from 0-6.,,,relations,mean,users,similarity,"{""datatype"": {""base"": ""json"", ""format"": ""{\""type\"":\""object\"",\""patternProperties\"":{\"".+\"": {\""type\"": \""object\"", \""required\"":[\""Score\"",\""Concepticon_ID\""],\""properties\"":{\""Score\"":{\""type\"":\""number\""},\""Concepticon_ID\"":\""oneOf\"":[{\""type\"":\""number\""},{\""type\"":\""null\""}]}}}}""}, ""name"": ""HEBREW_SIMILARITY""}",
Vulic-2020-2244-POLISH_SIMILARITY,Vulic-2020-2244,pol,,The similarity to other words in the language rated on a scale from 0-6.,,,relations,mean,users,similarity,"{""datatype"": {""base"": ""json"", ""format"": ""{\""type\"":\""object\"",\""patternProperties\"":{\"".+\"": {\""type\"": \""object\"", \""required\"":[\""Score\"",\""Concepticon_ID\""],\""properties\"":{\""Score\"":{\""type\"":\""number\""},\""Concepticon_ID\"":\""oneOf\"":[{\""type\"":\""number\""},{\""type\"":\""null\""}]}}}}""}, ""name"": ""POLISH_SIMILARITY""}",
Vulic-2020-2244-RUSSIAN_SIMILARITY,Vulic-2020-2244,rus,,The similarity to other words in the language rated on a scale from 0-6.,,,relations,mean,users,similarity,"{""datatype"": {""base"": ""json"", ""format"": ""{\""type\"":\""object\"",\""patternProperties\"":{\"".+\"": {\""type\"": \""object\"", \""required\"":[\""Score\"",\""Concepticon_ID\""],\""properties\"":{\""Score\"":{\""type\"":\""number\""},\""Concepticon_ID\"":\""oneOf\"":[{\""type\"":\""number\""},{\""type\"":\""null\""}]}}}}""}, ""name"": ""RUSSIAN_SIMILARITY""}",
Vulic-2020-2244-SPANISH_SIMILARITY,Vulic-2020-2244,spa,,The similarity to other words in the language rated on a scale from 0-6.,,,relations,mean,users,similarity,"{""datatype"": {""base"": ""json"", ""format"": ""{\""type\"":\""object\"",\""patternProperties\"":{\"".+\"": {\""type\"": \""object\"", \""required\"":[\""Score\"",\""Concepticon_ID\""],\""properties\"":{\""Score\"":{\""type\"":\""number\""},\""Concepticon_ID\"":\""oneOf\"":[{\""type\"":\""number\""},{\""type\"":\""null\""}]}}}}""}, ""name"": ""SPANISH_SIMILARITY""}",
Vulic-2020-2244-CANTONESE_SIMILARITY,Vulic-2020-2244,zho,,The similarity to other words in the language rated on a scale from 0-6.,Cantonese,,relations,mean,users,similarity,"{""datatype"": {""base"": ""json"", ""format"": ""{\""type\"":\""object\"",\""patternProperties\"":{\"".+\"": {\""type\"": \""object\"", \""required\"":[\""Score\"",\""Concepticon_ID\""],\""properties\"":{\""Score\"":{\""type\"":\""number\""},\""Concepticon_ID\"":\""oneOf\"":[{\""type\"":\""number\""},{\""type\"":\""null\""}]}}}}""}, ""name"": ""CANTONESE_SIMILARITY""}",
Goz-2017-600-AOA_MEAN,Goz-2017-600,tur,,"Participants were asked to select the age at which they believed they had learned the word by circling one of the following seven options: 2–3, 3–4, 4–5, 5–6, 7–9, 10–11, and 12+. The words consisted of nouns and adjectives.",,,ratings,mean,users,AoA,"{""datatype"": {""base"": ""decimal"", ""minimum"": ""1"", ""maximum"": ""7""}, ""name"": ""AOA_MEAN""}",
Goz-2017-600-AOA_MEAN_CHILDREN,Goz-2017-600,tur,,"This value includes the mean AoA ratings for a subset of the participants (12-year-old children). Participants were asked to select the age at which they believed they had learned the word by circling one of the following seven options: 2–3, 3–4, 4–5, 5–6, 7–9, 10–11, and 12+. The words consisted of nouns and adjectives.",children,,ratings,mean,users,AoA,"{""datatype"": {""base"": ""decimal"", ""minimum"": ""1"", ""maximum"": ""7""}, ""name"": ""AOA_MEAN_CHILDREN""}",
Goz-2017-600-AOA_MEAN_YOUNG,Goz-2017-600,tur,,"This value includes the mean AoA ratings for a subset of the participants (young adults, 20–26 years of age). Participants were asked to select the age at which they believed they had learned the word by circling one of the following seven options: 2–3, 3–4, 4–5, 5–6, 7–9, 10–11, and 12+. The words consisted of nouns and adjectives.",young,,ratings,mean,users,AoA,"{""datatype"": {""base"": ""decimal"", ""minimum"": ""1"", ""maximum"": ""7""}, ""name"": ""AOA_MEAN_YOUNG""}",
Goz-2017-600-AOA_MEAN_MIDDLE,Goz-2017-600,tur,,"This value includes the mean AoA ratings for a subset of the participants (middle-aged adults, 40–45 years of age). Participants were asked to select the age at which they believed they had learned the word by circling one of the following seven options: 2–3, 3–4, 4–5, 5–6, 7–9, 10–11, and 12+. The words consisted of nouns and adjectives.",middle,,ratings,mean,users,AoA,"{""datatype"": {""base"": ""decimal"", ""minimum"": ""1"", ""maximum"": ""7""}, ""name"": ""AOA_MEAN_MIDDLE""}",
Goz-2017-600-AOA_MEAN_OLD,Goz-2017-600,tur,,"This value includes the mean AoA ratings for a subset of the participants (older adults, 60–87 years of age). Participants were asked to select the age at which they believed they had learned the word by circling one of the following seven options: 2–3, 3–4, 4–5, 5–6, 7–9, 10–11, and 12+. The words consisted of nouns and adjectives.",old,,ratings,mean,users,AoA,"{""datatype"": {""base"": ""decimal"", ""minimum"": ""1"", ""maximum"": ""7""}, ""name"": ""AOA_MEAN_OLD""}",
Goz-2017-600-MEAN_IMAGEABILITY,Goz-2017-600,tur,,Imageability estimates were based on a scale from 1 to 7.,,Tekcan2005,ratings,mean,users,imageability,"{""datatype"": {""base"": ""decimal"", ""minimum"": ""1"", ""maximum"": ""7""}, ""name"": ""MEAN_IMAGEABILITY""}",
Goz-2017-600-MEAN_CONCRETENESS,Goz-2017-600,tur,,Concreteness estimates were based on a scale from 1 to 7.,,Tekcan2005,ratings,mean,users,concreteness,"{""datatype"": {""base"": ""decimal"", ""minimum"": ""1"", ""maximum"": ""7""}, ""name"": ""MEAN_CONCRETENESS""}",
Goz-2017-600-FREQUENCY,Goz-2017-600,tur,,"This value is taken from a frequency dictionary of written Turkish based on 1,016,000 words obtained from a variety of written sources, published between 1995 and 2000.",,Goz2003,norms,tokens,corpus,frequency,"{""datatype"": {""base"": ""nonNegativeInteger"", ""maximum"": ""1016000""}, ""name"": ""FREQUENCY""}",
Speed-2021-Sensorimotor-DUTCH_AUDITORY_MEAN,Speed-2021-Sensorimotor,nld,,Mean rating (0-5) of how strongly the concept is experienced by hearing.,auditory,,ratings,mean,user,sensory modality,"{""datatype"": {""base"": ""decimal"", ""minimum"": ""0"", ""maximum"": ""5""}, ""name"": ""DUTCH_AUDITORY_MEAN"", ""titles"": ""Horen""}",
Speed-2021-Sensorimotor-DUTCH_GUSTATORY_MEAN,Speed-2021-Sensorimotor,nld,,Mean rating (0-5) of how strongly the concept is experienced by tasting.,gustatory,,ratings,mean,user,sensory modality,"{""datatype"": {""base"": ""decimal"", ""minimum"": ""0"", ""maximum"": ""5""}, ""name"": ""DUTCH_GUSTATORY_MEAN"", ""titles"": ""Proeven""}",
Speed-2021-Sensorimotor-DUTCH_HAPTIC_MEAN,Speed-2021-Sensorimotor,nld,,Mean rating (0-5) of how strongly the concept is experienced by feeling through touch.,haptic,,ratings,mean,user,sensory modality,"{""datatype"": {""base"": ""decimal"", ""minimum"": ""0"", ""maximum"": ""5""}, ""name"": ""DUTCH_HAPTIC_MEAN"", ""titles"": ""Voelen""}",
Speed-2021-Sensorimotor-DUTCH_INTEROCEPTIVE_MEAN,Speed-2021-Sensorimotor,nld,,Mean rating (0-5) of how strongly the concept is experienced by sensations inside the body.,interoceptive,,ratings,mean,user,sensory modality,"{""datatype"": {""base"": ""decimal"", ""minimum"": ""0"", ""maximum"": ""5""}, ""name"": ""DUTCH_INTEROCEPTIVE_MEAN"", ""titles"": ""Sensaties""}",
Speed-2021-Sensorimotor-DUTCH_OLFACTORY_MEAN,Speed-2021-Sensorimotor,nld,,Mean rating (0-5) of how strongly the concept is experienced by smelling.,olfactory,,ratings,mean,user,sensory modality,"{""datatype"": {""base"": ""decimal"", ""minimum"": ""0"", ""maximum"": ""5""}, ""name"": ""DUTCH_OLFACTORY_MEAN"", ""titles"": ""Ruiken""}",
Speed-2021-Sensorimotor-DUTCH_VISUAL_MEAN,Speed-2021-Sensorimotor,nld,,Mean rating (0-5) of how strongly the concept is experienced by seeing.,visual,,ratings,mean,user,sensory modality,"{""datatype"": {""base"": ""decimal"", ""minimum"": ""0"", ""maximum"": ""5""}, ""name"": ""DUTCH_VISUAL_MEAN"", ""titles"": ""Zien""}",
Speed-2021-Sensorimotor-DUTCH_PERCEPTUAL_DOMINANT,Speed-2021-Sensorimotor,nld,,Modality in which the concept is experienced the strongest  .,dominant perceptual strength,,ratings,linguistic,user,sensory modality,"{""datatype"": {""base"": ""string"", ""format"": ""Horen|Joint|Proeven|Ruiken|Sensaties|Voelen|Zien""}, ""name"": ""DUTCH_PERCEPTUAL_DOMINANT"", ""titles"": ""Modality""}",
Speed-2021-Sensorimotor-DUTCH_PERCEPTUAL_EXCLUSIVITY,Speed-2021-Sensorimotor,nld,,The degree to which a concept can be mapped onto one single perceptual modality. Calculated by dividing the range of ratings by the sum.,exclusivity perceptual strength,,ratings,percentage,user,sensory modality,"{""datatype"": {""base"": ""decimal"", ""minimum"": ""0"", ""maximum"": ""1""}, ""name"": ""DUTCH_PERCEPTUAL_EXCLUSIVITY"", ""titles"": ""ModalityExclusivity""}",
Speed-2021-Sensorimotor-DUTCH_PERCEPTUAL_STRENGTH_MAX,Speed-2021-Sensorimotor,nld,,Maximum perceptual strength.,maximum perceptual strength,,ratings,numeric,user,sensory modality,"{""datatype"": ""decimal"", ""name"": ""DUTCH_PERCEPTUAL_STRENGTH_MAX"", ""titles"": ""MaxPercStrength""}",
Speed-2021-Sensorimotor-DUTCH_PERCEPTUAL_STRENGTH_MEAN,Speed-2021-Sensorimotor,nld,,Average perceptual strength.,perceptual strength,,ratings,mean,user,sensory modality,"{""datatype"": ""decimal"", ""name"": ""DUTCH_PERCEPTUAL_STRENGTH_MEAN"", ""titles"": ""AvModalityStrength""}",
Speed-2021-Sensorimotor-DUTCH_PERCEPTUAL_STRENGTH_AGGREGATED,Speed-2021-Sensorimotor,nld,,Sensory strength across modalities with the effect of weaker modalities attenuated.,aggregated perceptual strength,,ratings,normalized,user,sensory modality,"{""datatype"": ""decimal"", ""name"": ""DUTCH_PERCEPTUAL_STRENGTH_AGGREGATED"", ""titles"": ""Minkowski3""}",
Chedid-2019-Familiarity-FRENCH_RT_MEAN,Chedid-2019-Familiarity,fra,,Mean of the response time for French nouns.,reaction time,,norms,mean,user,lexical decision,"{""datatype"": ""decimal"", ""name"": ""FRENCH_RT_MEAN"", ""titles"": ""Mean_RT""}",
Chedid-2019-Familiarity-FRENCH_FAMILIARITY_MEAN,Chedid-2019-Familiarity,fra,,Mean of the conceptual familiarity ratings based on a scale from 0 (extreme left) to 100 (extreme right).,,,ratings,mean,user,familiarity,"{""datatype"": {""base"": ""decimal"", ""minimum"": ""0"", ""maximum"": ""100""}, ""name"": ""FRENCH_FAMILIARITY_MEAN"", ""titles"": ""Mean_Word""}",
Chedid-2019-Familiarity-FRENCH_FAMILIARITY_MAX,Chedid-2019-Familiarity,fra,,The maximum of conceptual familiarity ratings based on a scale from 0 (extreme left) to 100 (extreme right).,maximum,,ratings,numeric,user,familiarity,"{""datatype"": {""base"": ""decimal"", ""minimum"": ""0"", ""maximum"": ""100""}, ""name"": ""FRENCH_FAMILIARITY_MAX"", ""titles"": ""MAX""}",
Chedid-2019-Familiarity-FRENCH_FAMILIARITY_MIN,Chedid-2019-Familiarity,fra,,The minimum of conceptual familiarity ratings based on a scale from 0 (extreme left) to 100 (extreme right).,minimum,,ratings,numeric,user,familiarity,"{""datatype"": {""base"": ""decimal"", ""minimum"": ""0"", ""maximum"": ""100""}, ""name"": ""FRENCH_FAMILIARITY_MIN"", ""titles"": ""MIN""}",
Zhong-2022-664-VISUAL_MEAN,Zhong-2022-664,zho,,Visual strength: mean rating (0–5) of how strongly the concept is experienced by seeing.,visual,,ratings,mean,user,sensory modality,"{""datatype"": {""base"": ""decimal"", ""minimum"": ""0"", ""maximum"": ""5""}, ""name"": ""VISUAL_MEAN""}",
Zhong-2022-664-AUDITORY_MEAN,Zhong-2022-664,zho,,Auditory strength: mean rating (0–5) of how strongly the concept is experienced by hearing.,auditory,,ratings,mean,user,sensory modality,"{""datatype"": {""base"": ""decimal"", ""minimum"": ""0"", ""maximum"": ""5""}, ""null"": [""5.210526316""], ""name"": ""AUDITORY_MEAN""}",
Zhong-2022-664-GUSTATORY_MEAN,Zhong-2022-664,zho,,Gustatory strength: mean rating (0–5) of how strongly the concept is experienced by tasting.,gustatory,,ratings,mean,user,sensory modality,"{""datatype"": {""base"": ""decimal"", ""minimum"": ""0"", ""maximum"": ""5""}, ""name"": ""GUSTATORY_MEAN""}",
Zhong-2022-664-OLFACTORY_MEAN,Zhong-2022-664,zho,,Olfactory strength: mean rating (0–5) of how strongly the concept is experienced by smelling.,olfactory,,ratings,mean,user,sensory modality,"{""datatype"": {""base"": ""decimal"", ""minimum"": ""0"", ""maximum"": ""5""}, ""name"": ""OLFACTORY_MEAN""}",
Zhong-2022-664-HAPTIC_MEAN,Zhong-2022-664,zho,,Haptic strength: mean rating (0–5) of how strongly the concept is experienced by feeling through touch.,haptic,,ratings,mean,user,sensory modality,"{""datatype"": {""base"": ""decimal"", ""minimum"": ""0"", ""maximum"": ""5""}, ""name"": ""HAPTIC_MEAN""}",
Zhong-2022-664-INTEROCEPTIVE_MEAN,Zhong-2022-664,zho,,Interoceptive strength: mean rating (0–5) of how strongly the concept is experienced by sensations inside the body.,interoceptive,,ratings,mean,user,sensory modality,"{""datatype"": {""base"": ""decimal"", ""minimum"": ""0"", ""maximum"": ""5""}, ""name"": ""INTEROCEPTIVE_MEAN""}",
Zhong-2022-664-PERCEPTUAL_MEAN,Zhong-2022-664,zho,,This value represents the mean perceptual strength.,perceptual strength,,ratings,mean,user,sensory modality,"{""datatype"": ""float"", ""name"": ""PERCEPTUAL_MEAN""}",
Zhong-2022-664-PERCEPTUAL_DOMINANT,Zhong-2022-664,zho,,"Perceptual modality through which the concept is experienced most strongly (i.e., with highest perceptual strength rating).",dominant perceptual strength,,ratings,linguistic,user,sensory modality,"{""datatype"": {""base"": ""string"", ""format"": ""auditory|gustatory|gustatory/olfactory|interoceptive|olfactory|tactile|visual|visual/interoceptive""}, ""name"": ""PERCEPTUAL_DOMINANT""}",
Zhong-2022-664-PERCEPTUAL_STRENGTH_MAX,Zhong-2022-664,zho,,"Perceptual strength in the dominant modality (i.e., highest strength rating across six perceptual modalities).",maximum perceptual strength,,ratings,numeric,user,sensory modality,"{""datatype"": ""float"", ""name"": ""PERCEPTUAL_STRENGTH_MAX""}",
Zhong-2022-664-PERCEPTUAL_STRENGTH_AGGREGATED,Zhong-2022-664,zho,,"Aggregated perceptual strength in all modalities where the influence of weaker modalities is attenuated, calculated as Minkowski distance (with exponent 3) of the 6-dimension vector of perceptual strength from the origin.",aggregated perceptual strength,,ratings,normalized,user,sensory modality,"{""datatype"": ""float"", ""name"": ""PERCEPTUAL_STRENGTH_AGGREGATED""}",
Zhong-2022-664-PERCEPTUAL_STRENGTH_SUM,Zhong-2022-664,zho,,This value represents the summarized perceptual strength.,perceptual strength,,ratings,sum,user,sensory modality,"{""datatype"": ""float"", ""name"": ""PERCEPTUAL_STRENGTH_SUM""}",
Zhong-2022-664-PERCEPTUAL_EXCLUSIVITY,Zhong-2022-664,zho,,"Modality exclusivity of the concept; the extent to which a concept is experienced through a single perceptual modality (0–1, typically expressed as %), calculated as the range of perceptual strength values divided by their sum.",exclusivity perceptual strength,,ratings,percentage,user,sensory modality,"{""datatype"": {""base"": ""decimal"", ""minimum"": ""0"", ""maximum"": ""1""}, ""name"": ""PERCEPTUAL_EXCLUSIVITY""}",
Zhong-2022-664-FOOT_ACTION_MEAN,Zhong-2022-664,zho,,Foot action strength: mean rating (0–5) of how strongly the concept is experienced by performaing an action with the foot / leg.,foot action strength,,ratings,mean,user,sensory modality,"{""datatype"": {""base"": ""decimal"", ""minimum"": ""0"", ""maximum"": ""5""}, ""name"": ""FOOT_ACTION_MEAN""}",
Zhong-2022-664-HAND_ACTION_MEAN,Zhong-2022-664,zho,,Hand action strength: mean rating (0–5) of how strongly the concept is experienced by performaing an action with the hand / arm.,hand action strength,,ratings,mean,user,sensory modality,"{""datatype"": {""base"": ""decimal"", ""minimum"": ""0"", ""maximum"": ""5""}, ""name"": ""HAND_ACTION_MEAN""}",
Zhong-2022-664-MOUTH_ACTION_MEAN,Zhong-2022-664,zho,,Mouth action strength: mean rating (0–5) of how strongly the concept is experienced by performaing an action with the mouth / throat.,mouth action strength,,ratings,mean,user,sensory modality,"{""datatype"": {""base"": ""decimal"", ""minimum"": ""0"", ""maximum"": ""5""}, ""name"": ""MOUTH_ACTION_MEAN""}",
Zhong-2022-664-HEAD_ACTION_MEAN,Zhong-2022-664,zho,,Head action strength: mean rating (0–5) of how strongly the concept is experienced by performaing an action with the head excluding mouth.,head action strength,,ratings,mean,user,sensory modality,"{""datatype"": {""base"": ""decimal"", ""minimum"": ""0"", ""maximum"": ""5""}, ""name"": ""HEAD_ACTION_MEAN""}",
Zhong-2022-664-TORSO_ACTION_MEAN,Zhong-2022-664,zho,,Torso action strength: mean rating (0–5) of how strongly the concept is experienced by performaing an action with the torso.,torso action strength,,ratings,mean,user,sensory modality,"{""datatype"": {""base"": ""decimal"", ""minimum"": ""0"", ""maximum"": ""5""}, ""name"": ""TORSO_ACTION_MEAN""}",
Zhong-2022-664-ACTION_STRENGTH_MEAN,Zhong-2022-664,zho,,This value represents the mean action effector strength.,action strength,,ratings,mean,user,sensory modality,"{""datatype"": ""float"", ""name"": ""ACTION_STRENGTH_MEAN""}",
Zhong-2022-664-ACTION_STRENGTH_SUM,Zhong-2022-664,zho,,This value represents the summarized action effector strength.,action strength,,ratings,sum,user,sensory modality,"{""datatype"": ""float"", ""name"": ""ACTION_STRENGTH_SUM""}",
Zhong-2022-664-ACTION_STRENGTH_MAX,Zhong-2022-664,zho,,"Action strength in the dominant effector (i.e., highest strength rating across five action effectors).",maximum action strength,,ratings,numeric,user,sensory modality,"{""datatype"": ""float"", ""name"": ""ACTION_STRENGTH_MAX""}",
Zhong-2022-664-ACTION_STRENGTH_AGGREGATED,Zhong-2022-664,zho,,"Aggregated action strength in all effectors where the influence of weaker effectors is attenuated, calculated as Minkowski distance (with exponent 3) of the 5-dimension vector of action strength from the origin.",aggregated action strength,,ratings,normalized,user,sensory modality,"{""datatype"": ""float"", ""name"": ""ACTION_STRENGTH_AGGREGATED""}",
Zhong-2022-664-ACTION_EXCLUSIVITY,Zhong-2022-664,zho,,"Effector exclusivity of the concept; the extent to which a concept is experienced through a single action effector (0–1, typically expressed as %), calculated as the range of action strength values divided by their sum.",exclusivity action strength,,ratings,percentage,user,sensory modality,"{""datatype"": {""base"": ""decimal"", ""minimum"": ""0"", ""maximum"": ""1""}, ""name"": ""ACTION_EXCLUSIVITY""}",
Zhong-2022-664-ACTION_DOMINANT,Zhong-2022-664,zho,,"Action effector through which the concept is experienced most strongly (i.e., with highest action strength rating).",dominant action strength,,ratings,linguistic,user,sensory modality,"{""datatype"": {""base"": ""string"", ""format"": ""hand/arm|hand/arm\\+head|hand/arm\\+mouth/throat|hand/arm\\+mouth/throat\\+head|hand/arm\\+torso|head|head\\+torso|leg/foot|leg/foot\\+hand/arm|leg/foot\\+head|leg/foot\\+torso|mouth/throat|mouth/throat\\+head|mouth/throat\\+torso|torso""}, ""name"": ""ACTION_DOMINANT""}",
Zhong-2022-664-SENSORIMOTOR_STRENGTH_MAX,Zhong-2022-664,zho,,"Sensorimotor strength in the dominant dimension (i.e., highest strength rating across 11 sensorimotor dimensions).",maximum sensorimotor strength,,ratings,numeric,user,sensory modality,"{""datatype"": ""float"", ""name"": ""SENSORIMOTOR_STRENGTH_MAX""}",
Zhong-2022-664-SENSORIMOTOR_DOMINANT,Zhong-2022-664,zho,,"Sensorimotor dimension through which the concept is experienced most strongly (i.e., with highest sensorimotor strength rating).",dominant sensorimotor strength,,ratings,linguistic,user,sensory modality,"{""datatype"": {""base"": ""string"", ""format"": ""auditory|auditory&month/throat|gustatory|gustatory&mouth/throat|gustatory/olfactory|hand/arm|interoceptive|leg/foot|mouth/throat|olfactory|tactile|visual|visual/interoceptive""}, ""name"": ""SENSORIMOTOR_DOMINANT""}",
Zhong-2022-664-SENSORIMOTOR_STRENGTH_AGGREGATED,Zhong-2022-664,zho,,"Aggregated sensorimotor strength in all dimensions where the influence of weaker dimensions is attenuated, calculated as Minkowski distance (with exponent 3) of the 11-dimension vector of sensorimotor strength from the origin.",aggregated sensorimotor strength,,ratings,normalized,user,sensory modality,"{""datatype"": ""float"", ""name"": ""SENSORIMOTOR_STRENGTH_AGGREGATED""}",
Zhong-2022-664-SENSORIMOTOR_STRENGTH_SUM,Zhong-2022-664,zho,,This value represents the summarized sensorimotor strength in all dimensions.,sensorimotor strength,,ratings,sum,user,sensory modality,"{""datatype"": ""float"", ""name"": ""SENSORIMOTOR_STRENGTH_SUM""}",
Zhong-2022-664-SENSORIMOTOR_EXCLUSIVITY,Zhong-2022-664,zho,,"Sensorimotor exclusivity of the concept; the extent to which a concept is experienced through a single sensorimotor dimension (0–1, typically expressed as %), calculated as the range of sensorimotor strength values divided by their sum.",exclusivity sensorimotor strength,,ratings,percentage,user,sensory modality,"{""datatype"": {""base"": ""decimal"", ""minimum"": ""0"", ""maximum"": ""1""}, ""name"": ""SENSORIMOTOR_EXCLUSIVITY""}",
